[
  {
    "schema_version": 1,
    "event_id": "run_1a0bb7aa7af52628b54:16",
    "run_id": "run_1a0bb7aa7af52628b54",
    "seq": 16,
    "recorded_at": "2026-09-19T21:11:55.336Z",
    "actor_id": "master",
    "actor_kind": "agent",
    "task_id": null,
    "causation_id": null,
    "type": "tool.called",
    "payload": {
      "args": {
        "artifact_refs": [
          {
            "artifact_id": "trading-sources.md",
            "revision": 0
          }
        ],
        "purpose": "handoff",
        "task_id": "t1",
        "text": "trading-sources.mdを要件抽出へ。",
        "to": "researcher"
      },
      "attempt": 1,
      "mode": "coordination",
      "ok": false,
      "result_chars": 137,
      "result_preview": "REJECTED: artifact trading-sources.md rev 0 does not exist. Copy the full artifact_id, including the file extension, from list_artifacts.",
      "tool": "send_message"
    }
  },
  {
    "schema_version": 1,
    "event_id": "run_1a0bb85dc7e671d12d4:15",
    "run_id": "run_1a0bb85dc7e671d12d4",
    "seq": 15,
    "recorded_at": "2026-09-19T21:16:42.800Z",
    "actor_id": "master",
    "actor_kind": "agent",
    "task_id": null,
    "causation_id": null,
    "type": "tool.called",
    "payload": {
      "args": {
        "purpose": "handoff",
        "task_id": "t1",
        "text": "t1 の担当です。trading-sources.md を元にし、注文識別、ステータス照会、紙取引 vs 実取引の境界、認証フローの要件を整理し、未検証事項を特定してください。出力：research/requirements.md。完了次第、t2 に引き渡します。",
        "to": "researcher"
      },
      "attempt": 1,
      "mode": "coordination",
      "ok": true,
      "result_chars": 122,
      "result_preview": "DELIVERED message_id=msg_1a0bb8751b01dd54a21 to=researcher task=t1. Use read_messages(wait_seconds=N) to wait for a reply.",
      "tool": "send_message"
    }
  }
]
